<ospf_conf xmlns:xsi="http://www.w3.org/2001/XMLSchema-instance"
  xsi:noNamespaceSchemaLocation="/usr/share/xml/vnx/ospf.xsd">

   <vm name="r1" type="quagga" subtype="lib-install">
      <zebra hostname="r1" password="xxxx"/>
      <passive_if>eth1</passive_if> 
      <network>
         <ip mask="16">10.0.0.0</ip>
         <area>0.0.0.0</area>
      </network>	
   </vm>

   <vm name="r2" type="quagga" subtype="lib-install">
      <zebra hostname="r2" password="xxxx"/>
      <passive_if>eth1</passive_if> 
      <network>
         <ip mask="16">10.0.0.0</ip>
         <area>0.0.0.0</area>
      </network>	
   </vm>

</ospf_conf>
